{
  "blyg": "0.3",
  "id": "1jt332depwffcsyfz9txf8c9r9",
  "kind": "fragment",
  "origin": "https://example.com/blyg/",
  "page": "f/1jt332depwffcsyfz9txf8c9r9/",
  "author": {
    "name": "Venkatesh Rao",
    "url": "https://example.com/blyg/"
  },
  "created": "2026-07-17T18:00:00Z",
  "updated": "2026-07-18T09:30:00Z",
  "version": 3,
  "content_md": "Markdown source of the *latest* version.",
  "content_html": "<p>Markdown source of the <em>latest</em> version.</p>",
  "content_hash": "sha256:8399113ac7ca4b73410a45fe1117e00d9936134f04147879592d3884a6ec7537",
  "changelog": [
    {
      "version": 1,
      "at": "2026-07-17T18:00:00Z",
      "note": null
    },
    {
      "version": 2,
      "at": "2026-07-17T21:12:00Z",
      "note": "typo",
      "pinned": true
    },
    {
      "version": 3,
      "at": "2026-07-18T09:30:00Z",
      "note": "sharpened the claim"
    }
  ]
}
